{
  "_QPVersion": "1.2.0",
  "name": "autoplay",
  "id": "auto-play",
  "author": "KittehChezBurbur",
  "version": "0.1.0",
  "packageId": "com.beatgames.beatsaber",
  "packageVersion": "1.40.8",
  "description": "all 115 114 113 get top 1 on every leaderboard never misses a single block",
  "isLibrary": false,
  "modFiles": [
    "libauto-play.so"
  ],
  "lateModFiles": [],
  "libraryFiles": [],
  "fileCopies": [],
  "copyExtensions": [],
  "dependencies": []
}